{
  "version": "1.0",
  "models": {
    "Cerebras-GLM-4.7": {
      "provider": "cerebras",
      "tier": "SPRINTER",
      "max_context": 50000,
      "max_output": 4000,
      "cost_per_1k_input": 0.0,
      "cost_per_1k_output": 0.0,
      "tokens_per_minute": 300000,
      "tokens_per_day": 24000000,
      "api_key_env": "CEREBRAS_API_KEY"
    },
    "gemini-3-flash": {
      "provider": "gemini_flash",
      "tier": "LIBRARIAN",
      "max_context": 1000000,
      "max_output": 8000,
      "cost_per_1k_input": 0.0001,
      "cost_per_1k_output": 0.0004,
      "tokens_per_minute": 150000,
      "tokens_per_day": 2000000,
      "supports_context_caching": true,
      "context_cache_threshold": 30000,
      "api_key_env": "GOOGLE_API_KEY"
    },
    "gemini-3-pro": {
      "provider": "gemini",
      "tier": "LIBRARIAN",
      "max_context": 2000000,
      "max_output": 8000,
      "cost_per_1k_input": 0.00025,
      "cost_per_1k_output": 0.001,
      "tokens_per_minute": 100000,
      "tokens_per_day": 2000000,
      "supports_context_caching": true,
      "context_cache_threshold": 30000,
      "api_key_env": "GOOGLE_API_KEY"
    },
    "chatgpt-codex-5.2": {
      "provider": "codex",
      "tier": "BUILDER_HIGH",
      "max_context": 128000,
      "max_output": 16000,
      "cost_per_1k_input": 0.003,
      "cost_per_1k_output": 0.015,
      "tokens_per_minute": 200000,
      "tokens_per_day": 10000000,
      "api_key_env": "OPENAI_API_KEY"
    },
    "claude-sonnet-4.5": {
      "provider": "claude_sonnet",
      "tier": "BUILDER_MID",
      "max_context": 200000,
      "max_output": 16000,
      "cost_per_1k_input": 0.003,
      "cost_per_1k_output": 0.015,
      "tokens_per_minute": 100000,
      "tokens_per_day": 5000000,
      "api_key_env": "ANTHROPIC_API_KEY"
    },
    "claude-opus-4.5": {
      "provider": "claude_opus",
      "tier": "ARCHITECT",
      "max_context": 200000,
      "max_output": 16000,
      "cost_per_1k_input": 0.015,
      "cost_per_1k_output": 0.075,
      "tokens_per_minute": 50000,
      "tokens_per_day": 1000000,
      "api_key_env": "ANTHROPIC_API_KEY"
    }
  },
  "routing": {
    "default_model": "gemini-3-flash",
    "task_overrides": {
      "security_audit": "ARCHITECT",
      "planning": "ARCHITECT",
      "unit_tests": "SPRINTER",
      "linting": "SPRINTER",
      "summarization": "LIBRARIAN"
    },
    "complexity_thresholds": {
      "low_max": 1000,
      "medium_max": 5000,
      "high_max": 20000
    }
  },
  "pack_governor": {
    "max_coding_agents": 2,
    "max_reviewer_agents": 1,
    "force_summary_mode_threshold": 50000,
    "summary_model": "gemini-3-flash"
  }
}
